{
    "name": "Test3",
    "authors": [{
        "name": "Tumppi066",
        "url": "https://github.com/Tumppi066",
        "avatar": "https://avatars.githubusercontent.com/u/83072683?v=4"
    }],
    "description": "Lorem ea enim tempor Lorem in ad duis nisi. Est velit cillum occaecat eiusmod eiusmod aliquip.",
    "version": "1.0",
    "modules": [],
    "settings": [
        {
            "specials": [
                {
                    "special": "Title",
                    "special_data": "NOTHING HERE IS REAL"
                },
                {
                    "special": "Description",
                    "special_data": "This is a test plugin that I used!"
                },
                {
                    "special": "Separator"
                }
            ]
        },
        {
            "name": "Username",
            "key": "username",
            "description": "This is your public display name. It can be your real name or a pseudonym. You can only change this once every 30 days.",
            "type": {
                "type": "string"
            }
        },
        {
            "name": "Email",
            "key": "email",
            "description": "You can manage verified email addresses in your email settings",
            "type": {
                "type": "enum",
                "options": ["m@example.com", "m@google.com", "m@support.com"]
            }
        },
        {
            "name": "Test Boolean",
            "key": "test_boolean",
            "description": "Anim ullamco cillum proident aliqua elit. Nisi quis labore aute adipisicing elit do duis anim enim ullamco amet nisi minim. Consequat proident ad elit minim do exercitation id do amet velit mollit aute.",
            "type": {
                "type": "boolean"
            }
        },
        {
            "name": "Test array",
            "key": "test_array",
            "description": "Anim ullamco cillum proident aliqua elit. Nisi quis labore aute adipisicing elit do duis anim enim ullamco amet nisi minim. Consequat proident ad elit minim do exercitation id do amet velit mollit aute.",
            "type": {
                "type": "array",
                "value_type": "number"
            }
        },
        {
            "name": "Test Object",
            "key": "test_object",
            "description": "Anim ullamco cillum proident aliqua elit. Nisi quis labore aute adipisicing elit do duis anim enim ullamco amet nisi minim. Consequat proident ad elit minim do exercitation id do amet velit mollit aute.",
            "type": {
                "type": "object"
            }
        }
    ]
}